filename,notes,authors,licenses,urls
body/bodies/male/light.png,"see details at https://opengameart.org/content/lpc-character-bases; 'Thick' Male Revised Run/Climb by JaidynReiman (based on ElizaWy's LPC Revised)","bluecarrot16,JaidynReiman,Benjamin K. Smith (BenCreating),Evert,Eliza Wyatt (ElizaWy),TheraHedwig,MuffinElZangano,Durrani,Johannes Sjölund (wulax),Stephen Challener (Redshrike)","OGA-BY 3.0,CC-BY-SA 3.0,GPL 3.0","https://opengameart.org/content/liberated-pixel-cup-lpc-base-assets-sprites-map-tiles,https://opengameart.org/content/lpc-medieval-fantasy-character-sprites,https://opengameart.org/content/lpc-male-jumping-animation-by-durrani,https://opengameart.org/content/lpc-runcycle-and-diagonal-walkcycle,https://opengameart.org/content/lpc-revised-character-basics,https://opengameart.org/content/lpc-be-seated,https://opengameart.org/content/lpc-runcycle-for-male-muscular-and-pregnant-character-bases-with-modular-heads,https://opengameart.org/content/lpc-jump-expanded,https://opengameart.org/content/lpc-character-bases"
head/heads/human/male_elderly/light.png,"","Benjamin K. Smith (BenCreating),Eliza Wyatt (ElizaWy),Stephen Challener (Redshrike)","OGA-BY 3.0,CC-BY 3.0","https://opengameart.org/content/liberated-pixel-cup-lpc-base-assets-sprites-map-tiles,https://opengameart.org/content/lpc-revised-elders,https://opengameart.org/content/lpc-character-bases"
eyes/human/elderly/default/gray.png,"original by Redshrike, mapped to all frames by Matthew Krohn & JaidynReiman","JaidynReiman,Matthew Krohn (makrohn),Stephen Challener (Redshrike)","OGA-BY 3.0,CC-BY-SA 3.0,GPL 3.0","https://opengameart.org/content/liberated-pixel-cup-lpc-base-assets-sprites-map-tiles"
hair/balding/adult/white.png,"","ElizaWy","OGA-BY 3.0","https://opengameart.org/content/lpc-hair"
torso/clothes/longsleeve/longsleeve2/male/slate.png,"original by ElizaWy; spellcast/thrust/shoot/hurt/male adapted from original by JaidynReiman","ElizaWy,JaidynReiman,Stephen Challener (Redshrike),Johannes Sjölund (wulax)","OGA-BY 3.0","https://opengameart.org/content/lpc-revised-character-basics,https://github.com/ElizaWy/LPC/tree/main/Characters/Clothing,https://opengameart.org/content/lpc-expanded-sit-run-jump-more,https://opengameart.org/content/lpc-expanded-simple-shirts"
torso/aprons/overalls/male/leather.png,"original overalls by ElizaWy, extended to all animation frames, adapted from teen to male base, and edited for v3 bases by bluecarrot16; extended to combat animations by JaidynReiman","ElizaWy,bluecarrot16,JaidynReiman","OGA-BY 3.0,GPL 3.0","https://opengameart.org/content/lpc-revised-character-basics,http://opengameart.org/content/lpc-clothing-updates"
feet/boots/basic/male/black.png,"original by Nila122, edited for male and v3 bases by bluecarrot16, Jump/Sit/Emote/Run/Revised Combat by JaidynReiman","JaidynReiman,bluecarrot16,Nila122","OGA-BY 3.0,CC-BY-SA 3.0,GPL 2.0,GPL 3.0","https://opengameart.org/content/lpc-clothes-and-hair,https://opengameart.org/content/lpc-expanded-socks-shoes"
